title,description
Star Trek: The Original Series,"In the 23rd Century, Captain James T. Kirk and the crew of the U.S.S. Enterprise explore the galaxy and defend the United Federation of Planets."
The Next 365 Days,Laura and Massimo's relationship hangs in the balance as they try to overcome trust issues and jealousy while a tenacious Nacho works to push them apart.
Don't Look Up,Two low-level astronomers must go on a giant media tour to warn humankind of an approaching comet that will destroy planet Earth.
Murdoch Mysteries,"In the 1890s, William Murdoch uses radical forensic techniques for the time, including fingerprinting and trace evidence, to solve some of the city's most gruesome murders."
The Good Wife,"Alicia Florrick has been a good wife to her husband, a former state's attorney. After a very humiliating sex and corruption scandal, he is behind bars. She must now provide for her family and returns to work as a litigator in a law firm."
Shadow and Bone,Dark forces conspire against orphan mapmaker Alina Starkov when she unleashes an extraordinary power that could change the fate of her war-torn world.
Sex/Life,A suburban mother of two takes a fantasy-charged trip down memory lane that sets her very married present on a collision course with her wild-child past.
Gladiator,A former Roman General sets out to exact vengeance against the corrupt emperor who murdered his family and sent him into slavery.
The Punisher,"After the murder of his family, Marine veteran Frank Castle becomes the vigilante known as ""The Punisher,"" with only one goal in mind: to avenge them."
Midnight Mass,"An isolated island community experiences miraculous events - and frightening omens - after the arrival of a charismatic, mysterious young priest."
"Roswell, New Mexico","Centers on a town where aliens with unearthly abilities live undercover among humans. But when a violent attack points to a greater alien presence, the politics of fear and hatred threaten to expose them."
Taxi Driver,"A mentally unstable veteran works as a nighttime taxi driver in New York City, where the perceived decadence and sleaze fuels his urge for violent action."
Teen Wolf,An average high school student and his best friend get caught up in some trouble causing him to receive a werewolf bite. As a result they find themselves in the middle of all sorts of dramas in Beacon Hills.
Vikings: Valhalla,"Follow-up series to 'Vikings' set 100 years afterward and centering on the adventures of Leif Erikson, Freydis, Harald Hardrada and the Norman King William the Conqueror."
New Amsterdam,A new medical director breaks the rules to heal the system at America's oldest public hospital.
Léon: The Professional,"12-year-old Mathilda is reluctantly taken in by Léon, a professional assassin, after her family is murdered. An unusual relationship forms as she becomes his protégée and learns the assassin's trade."
Arrow,"Spoiled billionaire playboy Oliver Queen is missing and presumed dead when his yacht is lost at sea. He returns five years later a changed man, determined to clean up the city as a hooded vigilante armed with a bow."
The Good Nurse,An infamous caregiver is implicated in the deaths of hundreds of hospital patients.
The Good Place,Four people and their otherworldly frienemy struggle in the afterlife to define what it means to be good.
Agents of S.H.I.E.L.D.,"The missions of the Strategic Homeland Intervention, Enforcement and Logistics Division."
Mother!,"A couple's relationship is tested when uninvited guests arrive at their home, disrupting their tranquil existence."
Hustle,A basketball scout discovers a phenomenal street ball player while in Spain and sees the prospect as his opportunity to get back into the NBA.
Terim,"Legendary manager Fatih Terim recounts his football journey, from his playing days to coaching and leading several teams to championship glory."
365 Days: This Day,Laura and Massimo are back and stronger than ever. But Massimo's family ties and a mysterious man bidding for Laura's heart complicate the lovers' lives.
Cheers,"The regulars of the Boston bar ""Cheers"" share their experiences and lives with each other while drinking or working at the bar where everybody knows your name."
Line of Duty,"Drama series following the investigations of AC-12, a controversial police anti-corruption unit."
Pieces of Her,"On her 30th birthday out for lunch with her mother suddenly explodes into violence, an adrift young woman's conception of her mother is forever changed."
The Departed,An undercover cop and a mole in the police attempt to identify each other while infiltrating an Irish gang in South Boston.
Star Wars: The Clone Wars,Jedi Knights lead the Grand Army of the Republic against the droid army of the Separatists.
Star Trek: Deep Space Nine,"In the vicinity of the liberated planet of Bajor, the Federation space station Deep Space Nine guards the opening of a stable wormhole to the far side of the galaxy."
Spider-Man,"After being bitten by a genetically-modified spider, a shy teenager gains spider-like abilities that he uses to fight injustice as a masked superhero and face a vengeful enemy."
Santo,"Santo is a drug dealer whose face has never been revealed. Two policemen who go after him, Millán and Cardona, radically opposed, will have to learn to collaborate to solve the case and keep their lives safe."
Delhi Crime,"Based on the Nirbhaya case, Delhi Crime follows the Delhi Police investigation into the finding of the men who perpetrated this crime."
JoJo's Bizarre Adventure,"The story of the Joestar family, who are possessed with intense psychic strength, and the adventures each member encounters throughout their lives."
House of Cards,A Congressman works with his equally conniving wife to exact revenge on the people who betrayed him.
American Crime Story,An anthology series centered around America's most notorious crimes and criminals.
Beauty and the Beast,"A selfish Prince is cursed to become a monster for the rest of his life, unless he learns to fall in love with a beautiful young woman he keeps prisoner."
Dynasty,Follows two of America's wealthiest families as they feud for control over their fortune and their children.
Glee,A group of ambitious misfits try to escape the harsh realities of high school by joining a glee club headed by a passionate Spanish teacher.
Brooklyn,"An Irish immigrant lands in 1950s Brooklyn, where she quickly falls into a romance with a local. When her past catches up with her, however, she must choose between two countries and the lives that exist within."
The Americans,"At the height of the Cold War, two Russian agents pose as the average American couple, complete with family."
Gotham,The story behind Detective James Gordon's rise to prominence in Gotham City in the years before Batman's arrival.
Gossip Girl,Privileged teens living on the Upper East Side of New York can hide no secret from the ruthless blogger who is always watching.
Gone Girl,"With his wife's disappearance having become the focus of an intense media circus, a man sees the spotlight turned on him when it's suspected that he may not be innocent."
The Tudors,A dramatic series about the reign and marriages of King Henry VIII.
Twin Peaks,An idiosyncratic FBI agent investigates the murder of a young woman in the even more idiosyncratic town of Twin Peaks.
The Poison Rose,"Inspired by classic film noir, Carson Phillips, an ex-football star turned PI, has a soft spot for a lady in distress."
Avatar: The Last Airbender,"In a war-torn world of elemental magic, a young boy reawakens to undertake a dangerous mystic quest to fulfill his destiny as the Avatar, and bring peace to the world."
Hannibal,Explores the early relationship between renowned psychiatrist Hannibal Lecter and a young FBI criminal profiler who is haunted by his ability to empathize with serial killers.
Star Trek: Voyager,"Pulled to the far side of the galaxy, where the Federation is seventy-five years away at maximum warp speed, a Starfleet ship must cooperate with Maquis rebels to find a way home."
NCIS: Los Angeles,"The Naval Criminal Investigation Service's Office of Special Projects takes on the undercover work and the hard to crack cases in LA. Key agents are G. Callen and Sam Hanna, streets kids risen through the ranks."
Persuasion,"Eight years after Anne Elliot was persuaded not to marry a dashing man of humble origins, they meet again. Will she seize her second chance at true love?"
Good Girls,Three suburban mothers suddenly find themselves in desperate circumstances and decide to stop playing it safe and risk everything to take back their power.
Dated and Related,Pairs of siblings see each other's love life up close and personal as they search for 'the one' together. Will they act as the ultimate wingman to help you find love? Or scupper your plans?
