title,description
Cobra Kai,"Decades after their 1984 All Valley Karate Tournament bout, a middle-aged Daniel LaRusso and Johnny Lawrence find themselves martial-arts rivals again."
The Crown,Follows the political rivalries and romance of Queen Elizabeth II's reign and the events that shaped the second half of the twentieth century.
Better Call Saul,The trials and tribulations of criminal lawyer Jimmy McGill before his fateful run-in with Walter White and Jesse Pinkman.
Devil in Ohio,"When a psychiatrist shelters a mysterious cult escapee, her world is turned upside down as the girl's arrival threatens to tear her own family apart."
Cyberpunk: Edgerunners,"A Street Kid trying to survive in a technology and body modification-obsessed city of the future. Having everything to lose, he chooses to stay alive by becoming an Edgerunner, a Mercenary outlaw also known as a Cyberpunk."
The Sandman,"Upon escaping after decades of imprisonment by a mortal wizard, Dream, the personification of dreams, sets about to reclaim his lost equipment."
Rick and Morty,An animated series that follows the exploits of a super scientist and his not-so-bright grandson.
Breaking Bad,A high school chemistry teacher diagnosed with inoperable lung cancer turns to manufacturing and selling methamphetamine in order to secure his family's future.
The Imperfects,"After an experimental gene therapy turns them into monsters, three twenty-somethings band together to hunt down the scientist responsible and force him to make them human again."
Blonde,A fictionalized chronicle of the inner life of Marilyn Monroe.
Stranger Things,"When a young boy disappears, his mother, a police chief and his friends must confront terrifying supernatural forces in order to get him back."
End of the Road,"In this high-octane action thriller, a cross-country road trip becomes a highway to hell for Brenda and her family. Alone in the New Mexico desert, they have to fight for their lives when they become the targets of a mysterious killer."
The Walking Dead,Sheriff Deputy Rick Grimes wakes up from a coma to learn the world is in ruins and must lead a group of survivors to stay alive.
Glass Onion: A Knives Out Mystery,Famed Southern detective Benoit Blanc travels to Greece for his latest case.
Do Revenge,Drea and Eleanor agree to go after one another's bullies.
I Came By,Follows a young graffiti artist who discovers a shocking secret that would put him and the ones closest to him in danger.
No Limit,Roxana Aubrey decides to drop her studies and escape her life in Paris for a free diving course in the south of France. She is quickly pulled into a life that reaches new depths brought by the weight of an ocean's descent.
1899,Multinational immigrants traveling from the old continent to the new encounter a nightmarish riddle aboard a second ship adrift on the open sea.
Peaky Blinders,"A gangster family epic set in 1900s England, centering on a gang who sew razor blades in the peaks of their caps, and their fierce boss Tommy Shelby."
Fate: The Winx Saga,"A live-action adaptation of Nickelodeon's Winx Club (2004). It follows Bloom as she adjusts to life in the Otherworld, where she must learn to control her dangerous magical powers."
The Lord of the Rings: The Fellowship of the Ring,A meek Hobbit from the Shire and eight companions set out on a journey to destroy the powerful One Ring and save Middle-earth from the Dark Lord Sauron.
Grey's Anatomy,A drama centered on the personal and professional lives of five surgical interns and their supervisors.
Supernatural,"Two brothers follow their father's footsteps as hunters, fighting evil supernatural beings of many kinds, including monsters, demons and gods that roam the earth."
American Horror Story,"An anthology series centering on different characters and locations, including a house with a murderous past, an insane asylum, a witch coven, a freak show circus, a haunted hotel, a possessed farmhouse, a cult, the apocalypse, a slasher summer camp, and a bleak beach town and desert valley."
The Accidental Narco,A civilian businessman who has no choice but to cooperate with the secret operation of the National Intelligence Service to arrest the Korean drug lord who has taken control of Suriname in South America.
NCIS,"The cases of the Naval Criminal Investigative Service's Washington, D.C. Major Case Response Team, led by Special Agent Leroy Jethro Gibbs."
Friends,Follows the personal and professional lives of six twenty to thirty-something-year-old friends living in Manhattan.
Shameless,"A scrappy, feisty, fiercely loyal Chicago family makes no apologies."
Modern Family,Three different but related families face trials and tribulations in their own uniquely comedic ways.
Ozark,"A financial advisor drags his family from Chicago to the Missouri Ozarks, where he must launder money to appease a drug boss."
Echoes,"Leni and Gina are identical twins who have secretly swapped their lives since they were children, culminating in a double life as adults, but one of the sisters goes missing and everything in their perfectly schemed world turns into chaos."
The Gray Man,"When the CIA's most skilled operative-whose true identity is known to none-accidentally uncovers dark agency secrets, a psychopathic former colleague puts a bounty on his head, setting off a global manhunt by international assassins."
Me Time,Follows a dad who finds time for himself for the first time in years while his wife and kids are away. He reconnects with a friend for a wild weekend.
Suits,"On the run from a drug deal gone bad, brilliant college dropout Mike Ross finds himself working with Harvey Specter, one of New York City's best lawyers."
Vikings,"Vikings transports us to the brutal and mysterious world of Ragnar Lothbrok, a Viking warrior and farmer who yearns to explore--and raid--the distant shores across the ocean."
The Witcher,"Geralt of Rivia, a solitary monster hunter, struggles to find his place in a world where people often prove more wicked than beasts."
The Blacklist,"A new FBI profiler, Elizabeth Keen, has her entire life uprooted when a mysterious criminal, Raymond Reddington, who has eluded capture for decades, turns himself in and insists on speaking only to her."
Seinfeld,The continuing misadventures of neurotic New York City stand-up comedian Jerry Seinfeld and his equally neurotic New York City friends.
Lucifer,Lucifer Morningstar has decided he's had enough of being the dutiful servant in Hell and decides to spend some time on Earth to better understand humanity. He settles in Los Angeles - the City of Angels.
The Umbrella Academy,"A family of former child heroes, now grown apart, must reunite to continue to protect the world."
The Last Kingdom,"As Alfred the Great defends his kingdom from Norse invaders, Uhtred--born a Saxon but raised by Vikings--seeks to claim his ancestral birthright."
Partner Track,"Centers on Ingrid Yun, an idealistic young lawyer, struggles with her moral compass and her passions as she fights to climb the partner track at an elite New York City law firm."
Love in the Villa,"A young woman takes a trip to romantic Verona, Italy, after a breakup, only to find that the villa she reserved was double-booked, and she'll have to share her vacation with a cynical British man."
Black Mirror,"An anthology series exploring a twisted, high-tech multiverse where humanity's greatest innovations and darkest instincts collide."
Brooklyn Nine-Nine,"Comedy series following the exploits of Det. Jake Peralta and his diverse, lovable colleagues as they police the NYPD's 99th Precinct."
Squid Game,"Hundreds of cash-strapped players accept a strange invitation to compete in children's games. Inside, a tempting prize awaits with deadly high stakes. A survival game that has a whopping 45.6 billion-won prize at stake."
Gilmore Girls,"A dramedy centering around the relationship between a thirtysomething single mother and her teen daughter living in Stars Hollow, Connecticut."
Outlander,An English combat nurse from 1945 is mysteriously swept back in time to 1743.
Ófærð,"In a remote town in Iceland, Police desperately try to solve a crime as a powerful storm descends upon the town."
Never Have I Ever,"The complicated life of a modern-day first generation Indian American teenage girl, inspired by Mindy Kaling's own childhood."
Attack on Titan,"After his hometown is destroyed and his mother is killed, young Eren Jaeger vows to cleanse the earth of the giant humanoid Titans that have brought humanity to the brink of extinction."
Manifest,"A commercial airliner suddenly reappears after being missing for five years. As those aboard reintegrate into society, they experience guiding voices and visions of events yet to occur, and soon a deeper mystery unfolds."
Locke & Key,"After their father is murdered under mysterious circumstances, the three Locke siblings and their mother move into their ancestral home, Keyhouse, which they discover is full of magical keys that may be connected to their father's death."
Day Shift,"A hard-working, blue-collar dad just wants to provide a good life for his quick-witted 10-year-old daughter. His mundane San Fernando Valley pool cleaning job is a front for his real source of income: hunting and killing vampires."
Dark,"A family saga with a supernatural twist, set in a German town where the disappearance of two young children exposes the relationships among four families."
Guillermo del Toro's Pinocchio,A darker version of the classic children's fairy tale of a wooden puppet that transforms into a real living boy.
Sex Education,A teenage boy with a sex therapist mother teams up with a high school classmate to set up an underground sex therapy clinic at school.
The Lord of the Rings: The Return of the King,Gandalf and Aragorn lead the World of Men against Sauron's army to draw his gaze from Frodo and Sam as they approach Mount Doom with the One Ring.
The Vampire Diaries,"The lives, loves, dangers and disasters in the town, Mystic Falls, Virginia. Creatures of unspeakable horror lurk beneath this town as a teenage girl is suddenly torn between two vampire brothers."
Virgin River,"Seeking a fresh start, nurse practitioner Melinda Monroe moves from Los Angeles to a remote Northern California town and is surprised by what and who she finds."
Family Guy,"In a wacky Rhode Island town, a dysfunctional family strive to cope with everyday life as they are thrown from one crazy scenario to another."
Fargo,"Various chronicles of deception, intrigue and murder in and around frozen Minnesota. Yet all of these tales mysteriously lead back one way or another to Fargo, North Dakota."
Animal Kingdom,"Centers on a Southern California family, whose excessive lifestyle is fueled by their criminal activities."
Diario de un Gigoló,A gigolo's life begins to unravel when he becomes involved in a client's family affairs and violates the fundamental rule of his job: don't fall in love.
How I Met Your Mother,A father recounts to his children - through a series of flashbacks - the journey he and his four best friends took leading up to him meeting their mother.
The School for Good and Evil,Best friends Sophie and Agatha find themselves on opposing sides of an epic battle when they're swept away into an enchanted school where aspiring heroes and villains are trained to protect the balance between Good and Evil.
Heartbreak High,"A fresh look at Hartley High over 20 years on. With her new friends - outsiders Quinni and Darren - Amerie must repair her reputation, while navigating love, sex, and heartbreak."
Wednesday,"Follows Wednesday Addams' years as a student, when she attempts to master her emerging psychic ability, thwart and solve the mystery that embroiled her parents."
Community,A suspended lawyer is forced to enroll in a community college with an eccentric staff and student body.
Daredevil,"A blind lawyer by day, vigilante by night. Matt Murdock fights the crime of New York as Daredevil."
Blue Bloods,Revolves around a family of New York cops.
Bee and PuppyCat,"Bee, an unemployed woman is living a normal life, until a grumpy companion named PuppyCat arrives. Follow Bee and and PuppyCat as they travel between reality and ""Fishbowl Space""."
Loving Adults,Follows a couple who appear to be living the perfect life after their son is declared healthy following a long-term illness.
Schitt's Creek,"After being a victim of fraud, Johnny Rose and his family go from extremely wealthy to penniless overnight. The only asset left to them is a small, unsophisticated town: Schitt's Creek. They relocate there. Culture shock ensues."
Sing 2,Buster Moon and his friends must persuade reclusive rock star Clay Calloway to join them for the opening of a new show.
RRR,A fictitious story about two legendary revolutionaries and their journey away from home before they started fighting for their country in 1920s.
Arcane,"Set in utopian Piltover and the oppressed underground of Zaun, the story follows the origins of two iconic League champions-and the power that will tear them apart."
The Lørenskog Disappearance,What happened to Anne-Elisabeth Hagen? Where is she? Was she kidnapped by money launderers or is it her husband who may have made her disappear?
The Lord of the Rings: The Two Towers,"While Frodo and Sam edge closer to Mordor with the help of the shifty Gollum, the divided fellowship makes a stand against Sauron's new ally, Saruman, and his hordes of Isengard."
All Quiet on the Western Front,A young German soldier's terrifying experiences and distress on the western front during World War I.
Mr. Harrigan's Phone,"When Mr. Harrigan dies, the teen who befriended and did odd jobs for him, puts his smart phone in his pocket before burial and when the lonely youth leaves his dead friend a message, he is shocked to get a return text."
American Psycho,"A wealthy New York City investment banking executive, Patrick Bateman, hides his alternate psychopathic ego from his co-workers and friends as he delves deeper into his violent, hedonistic fantasies."
The Hobbit: An Unexpected Journey,"A reluctant Hobbit, Bilbo Baggins, sets out to the Lonely Mountain with a spirited group of dwarves to reclaim their mountain home, and the gold within it from the dragon Smaug."
Kleo,"After the fall of the Berlin Wall, a former spy killer is set free and embarks on a revenge spree against the people who conspired to betray her."
Riverdale,"While navigating the troubled waters of romance, school and family, Archie and his gang become entangled in dark Riverdale mysteries."
Sons of Anarchy,A biker struggles to balance being a father and being involved in an outlaw motorcycle club.
Mad Men,"A drama about one of New York's most prestigious ad agencies at the beginning of the 1960s, focusing on one of the firm's most mysterious but extremely talented ad executives, Donald Draper."
The Flash,"After being struck by lightning, Barry Allen wakes up from his coma to discover he's been given the power of super speed, becoming the Flash, and fighting crime in Central City."
Archer,Covert black ops and espionage take a back seat to zany personalities and relationships between secret agents and drones.
Dahmer - Monster: The Jeffrey Dahmer Story,Story of the Milwaukee Monster told from the perspective of the victims and police incompetency that allowed the Wisconsin native to go on a multiyear killing spree.
Mr. Robot,"Elliot, a brilliant but highly unstable young cyber-security engineer and vigilante hacker, becomes a key figure in a complex game of global dominance when he and his shadowy allies try to take down the corrupt corporation he works for."
That '70s Show,"A comedy revolving around a group of teenage friends, their mishaps, and their coming of age, set in 1970s Wisconsin."
You,"A dangerously charming, intensely obsessive young man goes to extreme measures to insert himself into the lives of those he is transfixed by."
Look Both Ways,"On the eve of her college graduation, Natalie's life diverges into parallel realities: one in which she becomes pregnant and remains in her hometown to raise her child and another in which she moves to LA to pursue her dream career."
365 Days,"Massimo is a member of the Sicilian Mafia family and Laura is a sales director. She does not expect that on a trip to Sicily trying to save her relationship, Massimo will kidnap her and give her 365 days to fall in love with him."
I Used to Be Famous,"Follows Vince, a desperate former popstar who dreams of making a comeback. An impromptu jam session with autistic young drummer Stevie sparks an unexpected friendship between the two misunderstood musicians."
Titanic,"A seventeen-year-old aristocrat falls in love with a kind but poor artist aboard the luxurious, ill-fated R.M.S. Titanic."
Bridgerton,"Wealth, lust, and betrayal set against the backdrop of Regency-era England, seen through the eyes of the powerful Bridgerton family."
Sherlock,A modern update finds the famous sleuth and his doctor partner solving crime in 21st-century London.
Dexter,"He's smart. He's lovable. He's Dexter Morgan, America's favorite serial killer, who spends his days solving crimes and nights committing them. Golden Globe winner Michael C. Hall stars in the hit SHOWTIME Original Series."
New Girl,"After a bad break-up, Jess, an offbeat young woman, moves into an apartment loft with three single men. Although they find her behavior very unusual, the men support her - most of the time."
The Expanse,"In the 24th century, a group of humans untangle a vast plot which threatens the Solar System's fragile state of detente."
Purple Hearts,"In spite of their many differences, Cassie, a struggling singer-songwriter, and Luke, a troubled Marine, agree to marry solely for military benefits. But when tragedy strikes, the line between real and pretend begins to blur."
The Gentlemen,"An American expat tries to sell off his highly profitable marijuana empire in London, triggering plots, schemes, bribery and blackmail in an attempt to steal his domain out from under him."
The Good Doctor,"Shaun Murphy, a young surgeon with autism and Savant syndrome, is recruited into the surgical unit of a prestigious hospital."
Downton Abbey,A chronicle of the lives of the British aristocratic Crawley family and their servants in the early twentieth century.
Extraordinary Attorney Woo,"About an autistic 27-year-old lawyer. Due to her high IQ of 164, impressive memory, and creative thought process, the brilliant Woo Young Woo graduated at the top of her class from a prestigious law school."
Smallville,"A young Clark Kent struggles to find his place in the world as he learns to harness his alien powers for good and deals with the typical troubles of teenage life in Smallville, Kansas."
Star Trek: The Next Generation,"Set almost 100 years after Captain Kirk's 5-year mission, a new generation of Starfleet officers set off in the U.S.S. Enterprise-D on its own mission to go where no one has gone before."
BoJack Horseman,"BoJack Horseman was the star of the hit television show ""Horsin' Around"" in the '80s and '90s, but now he's washed up, living in Hollywood, complaining about everything, and wearing colorful sweaters."
"Love, Death & Robots","A collection of animated short stories that span various genres including science fiction, fantasy, horror and comedy."
Money Heist,An unusual group of robbers attempt to carry out the most perfect robbery in Spanish history - stealing 2.4 billion euros from the Royal Mint of Spain.
Orange Is the New Black,"Convicted of a decade old crime of transporting drug money to an ex-girlfriend, normally law-abiding Piper Chapman is sentenced to a year and a half behind bars to face the reality of how life-changing prison can really be."
Jurassic Park,A pragmatic paleontologist touring an almost complete theme park on an island in Central America is tasked with protecting a couple of kids after a power failure causes the park's cloned dinosaurs to run loose.
Prison Break,"Due to a political conspiracy, an innocent man is sent to death row and his only hope is his brother, who makes it his mission to deliberately get himself sent to the same prison in order to break the both of them out, from the inside."
Billions,"New money means no mercy as Mike Prince takes the Axe Capital throne. Chuck Rhoades is convinced no one should have that much wealth - or power. As all the players seek out new alliances, only one thing's for certain - wealth means war."
Once Upon a Time,A young woman with a troubled past is drawn to a small town in Maine where fairy tales are to be believed.
Titans,A team of young superheroes combat evil and other perils.
The 100,"Set 97 years after a nuclear war destroyed civilization, when a spaceship housing humanity's lone survivors sends 100 juvenile delinquents back to Earth, hoping to repopulate the planet."
Jaws,"When a killer shark unleashes chaos on a beach community off Cape Cod, it's up to a local sheriff, a marine biologist, and an old seafarer to hunt the beast down."
The Catholic School,"In late September 1975, a renowned Catholic school in Rome for sheltered, upper-middle-class boys is attacked in what became known as the Circeo Massacre. The film examines what triggered the violence."
South Park,"Follows the misadventures of four irreverent grade-schoolers in the quiet, dysfunctional town of South Park, Colorado."
Spartacus,"The life of Spartacus, the gladiator who lead a rebellion against the Romans. From his time as an ally of the Romans, to his betrayal and becoming a gladiator, to the rebellion he leads and its ultimate outcome."
Clueless,"Shallow, rich and socially successful Cher is at the top of her Beverly Hills high school's pecking scale. Seeing herself as a matchmaker, Cher first coaxes two teachers into dating each other."
Chesapeake Shores,"A young woman returns to her hometown to help save her sister's failing inn, where she contends with memories and faces from her past."
Demon Slayer: Kimetsu no Yaiba,"A family is attacked by demons and only two members survive - Tanjiro and his sister Nezuko, who is turning into a demon slowly. Tanjiro sets out to become a demon slayer to avenge his family and cure his sister."
The Queen's Gambit,"Orphaned at the tender age of nine, prodigious introvert Beth Harmon discovers and masters the game of chess in 1960s USA. But child stardom comes at a price."
Pretty Little Liars,"Four friends band together against an anonymous foe who threatens to reveal their darkest secrets, while also investigating the disappearance of their best friend."
Mindhunter,"Set in the late 1970s, two FBI agents are tasked with interviewing serial killers to solve open cases."
"Murder, She Wrote","Professional writer and amateur sleuth Jessica Fletcher uses her intellect, charm, and persistence to get to the bottom of every crime she encounters."
From,"Unravel the mystery of a city in middle U.S.A. that imprisons everyone who enters. As the residents struggle to maintain a sense of normalcy and seek a way out, they must also survive the threats of the surrounding forest."
Spiderhead,"In the near future, convicts are offered the chance to volunteer as medical subjects to shorten their sentence. One such subject for a new drug capable of generating feelings of love begins questioning the reality of his emotions."
CSI: Crime Scene Investigation,Series following an elite team of police forensic evidence investigation experts as they work their cases in Las Vegas.
Evil,"A skeptical clinical psychologist joins a priest-in-training and a blue collar contractor as they investigate supposed abnormal events, including, demonic possession, and other extraordinary occurrences to see if there's a scientific explanation or if something truly supernatural's at work."
The Lincoln Lawyer,An iconoclastic idealist runs his law practice out of the back of his Lincoln Town Car in this series based on Michael Connelly's bestselling novels.
Arrested Development,"Level-headed son Michael Bluth takes over family affairs after his father is imprisoned. But the rest of his spoiled, dysfunctional family are making his job unbearable."
Heartland,"A multi-generational saga set in Alberta, Canada and centered on a family getting through life together in both happy and trying times."
Mo,"Mo Najjar who straddles the line between two cultures, three languages and ""a ton of bullshit."" The fictional Mo is a Palestinian refugee living one step away from asylum on the path to U.S. citizenship."
Inventing Anna,"A journalist with a lot to prove investigates the case of Anna Delvey, the Instagram-legendary German heiress who stole the hearts of New York's social scene - and stole their money as well."
It,"In the summer of 1989, a group of bullied kids band together to destroy a shape-shifting monster, which disguises itself as a clown and preys on the children of Derry, their small Maine town."
Narcos,"A chronicled look at the criminal exploits of Colombian drug lord Pablo Escobar, as well as the many other drug kingpins who plagued the country through the years."
The Sinner,Anthology series that examines how and why ordinary people commit brutal crimes.
Homeland,A bipolar CIA operative becomes convinced a prisoner of war has been turned by al-Qaeda and is planning to carry out a terrorist attack on American soil.
The Haunting of Hill House,"Flashing between past and present, a fractured family confronts haunting memories of their old home and the terrifying events that drove them from it."
Doc Martin,"The trials and tribulations of Dr. Martin Ellingham, who moves from London to the picturesque village of Portwenn in Cornwall."
Hawaii Five-0,"When Steve McGarrett returns home to Oahu to find his father's killer, the Governor offers him the chance to run his own task force: Five-0."
